<?xml version="1.0" encoding="UTF-8"?>

<post
	xmlns:xsd="http://www.w3.org/2001/XMLSchema"
	xmlns:xsi="http://www.w3.org/2001/XMLSchema-instance"
	xsi:noNamespaceSchemaLocation="../XSD/Post.xsd"
	userID="26" eventID="109">
	
	<eventType>Football</eventType>
	<eventDuration>PT110M</eventDuration>
	<postAut>
		<username>Holly998</username>
	</postAut>
	<postContent>
		<postTime unit="Min.">PT63M</postTime>
		<postElement>Goal</postElement>
		<postText>Great shot of E. Cavani and it's the 1-0 for Napoli!!</postText>
	</postContent>
	<postContent>
		<postTime unit="Min.">PT55M</postTime>
		<postElement>Yellow Card</postElement>
		<postText>Terrible foul from behind against Robben, deserved Yellow Card!</postText>
	</postContent>
	<postContent>
		<postTime unit="Min.">PT49M</postTime>
		<postElement>Corner</postElement>
		<postText>Another corner for Bayern, this time without consequences.</postText>
	</postContent>
	
</post>